{
  "schema_version": "datapan.canonical-update-promotion-journal.v1",
  "repository": "StatPan/datapan-registry",
  "records": [
    {
      "schema_version": "datapan.canonical-update-promotion-receipt.v1",
      "status": "pending-review",
      "action": "create",
      "source_refresh_evidence": {
        "schema_version": "datapan.canonical-source-refresh-evidence.v1",
        "registry_path": "data/data-go-kr.registry.json",
        "registry_bytes": 139155499,
        "registry_sha256": "0520d0db0d9ee07b7cbccce0c08439d0b02be901bf10e8491187d96e59d7a0d0",
        "verification_path": "reports/latest-verification.json",
        "verification_bytes": 4181898,
        "verification_sha256": "79999f8ace142f5238283aa22ef87c35c6a2bc9d9b347827e3a969db94726d61",
        "datapan_cli_revision": "e3b2fa44cb0f68d7e58e003fbd71ecde505878de",
        "datapan_cli_tree": "3ae55285f4a991530a7fcd7a58e51fb5967be90e",
        "generated_at": "2026-09-29T23:44:39Z",
        "output_normalization": "replace_top_level_generated_at_with_source_observation_time_utc_then_json_indent_2_newline",
        "diagnostic_current_source_applicability": {
          "path": "reports/diagnostic-current-source-applicability.json",
          "bytes": 25760,
          "sha256": "412feb02d0db7068c10548f00cfdcc5a9bc4893e7836354c6bde072399692b15",
          "schema_path": "schemas/datapan.diagnostic-current-source-applicability.v1.schema.json",
          "schema_bytes": 6763,
          "schema_sha256": "5e43e8aad27baefbcd2647e8b568763348584c4cf6b6512552863dab675d3b1d",
          "status": "revalidation_required"
        },
        "commands": [
          {
            "argv": [
              "go",
              "run",
              "./cmd/datapan",
              "catalog",
              "audit",
              "--registry",
              "/home/runner/work/datapan-registry/datapan-registry/data/data-go-kr.registry.json",
              "--output",
              "/home/runner/work/datapan-registry/datapan-registry/reports/catalog-audit.json",
              "--json"
            ],
            "exit_code": 0,
            "input_registry_sha256": "0520d0db0d9ee07b7cbccce0c08439d0b02be901bf10e8491187d96e59d7a0d0",
            "output_path": "reports/catalog-audit.json",
            "raw_output_bytes": 16232,
            "raw_output_sha256": "b780d2f573ec4b9e753f8e368cf29d0d9505e5a6a25a41f884bc889c05779a02",
            "output_bytes": 16232,
            "output_sha256": "0d565da1a84a93ba0e6ba751544ff79aca798390aaa8268f8f9a14e4e1ba0d94"
          },
          {
            "argv": [
              "go",
              "run",
              "./cmd/datapan",
              "catalog",
              "errors",
              "--registry",
              "/home/runner/work/datapan-registry/datapan-registry/data/data-go-kr.registry.json",
              "--limit",
              "0",
              "--output",
              "/home/runner/work/datapan-registry/datapan-registry/reports/error-catalog.json",
              "--json"
            ],
            "exit_code": 0,
            "input_registry_sha256": "0520d0db0d9ee07b7cbccce0c08439d0b02be901bf10e8491187d96e59d7a0d0",
            "output_path": "reports/error-catalog.json",
            "raw_output_bytes": 3324319,
            "raw_output_sha256": "c5e62dac6e45ab93ba3285f4e0850afb8bd01c141083b441f934708fcea3cc8d",
            "output_bytes": 3324319,
            "output_sha256": "a65376b9c192ab4ad7316ad0b584516230e41ea7f4aaa18f9de5c3a151ddfa9e"
          },
          {
            "argv": [
              "go",
              "run",
              "./cmd/datapan",
              "catalog",
              "dependencies",
              "--registry",
              "/home/runner/work/datapan-registry/datapan-registry/data/data-go-kr.registry.json",
              "--limit",
              "0",
              "--output",
              "/home/runner/work/datapan-registry/datapan-registry/reports/dependencies.json",
              "--json"
            ],
            "exit_code": 0,
            "input_registry_sha256": "0520d0db0d9ee07b7cbccce0c08439d0b02be901bf10e8491187d96e59d7a0d0",
            "output_path": "reports/dependencies.json",
            "raw_output_bytes": 19226969,
            "raw_output_sha256": "d4f31073464988dfe18aea8773689ce67dd3bf9e85c5f4ab19088184efaab4bd",
            "output_bytes": 19140444,
            "output_sha256": "ec2b7091462a70ae87332cd4ffde281082dd2ee3249a455d9be871ad6e69a298"
          },
          {
            "argv": [
              "go",
              "run",
              "./cmd/datapan",
              "catalog",
              "adapter-targets",
              "--registry",
              "/home/runner/work/datapan-registry/datapan-registry/data/data-go-kr.registry.json",
              "--limit",
              "0",
              "--output",
              "/home/runner/work/datapan-registry/datapan-registry/reports/adapter-targets.json",
              "--json"
            ],
            "exit_code": 0,
            "input_registry_sha256": "0520d0db0d9ee07b7cbccce0c08439d0b02be901bf10e8491187d96e59d7a0d0",
            "output_path": "reports/adapter-targets.json",
            "raw_output_bytes": 15979,
            "raw_output_sha256": "0dbb0eaa71b2a548130b761254fb4f6e30b25e801d4f43c4e4fe56461b199d8d",
            "output_bytes": 15979,
            "output_sha256": "1b76f5c7b065f587c8cf31ecffc20e159a4a78d07c0aa1d8cf0303a227c5aa3c"
          },
          {
            "argv": [
              "go",
              "run",
              "./cmd/datapan",
              "catalog",
              "providers",
              "--registry",
              "/home/runner/work/datapan-registry/datapan-registry/data/data-go-kr.registry.json",
              "--limit",
              "0",
              "--output",
              "/home/runner/work/datapan-registry/datapan-registry/reports/provider-backlog.json",
              "--json"
            ],
            "exit_code": 0,
            "input_registry_sha256": "0520d0db0d9ee07b7cbccce0c08439d0b02be901bf10e8491187d96e59d7a0d0",
            "output_path": "reports/provider-backlog.json",
            "raw_output_bytes": 108311,
            "raw_output_sha256": "3f79ba349f491a302b00f7a1293abdacc33b6656863625654293ef3040ed172c",
            "output_bytes": 108311,
            "output_sha256": "ba78ea3966ea3b3f199aa455532e31dfb361043c88424d2ab051d9e0b78a04f6"
          },
          {
            "argv": [
              "go",
              "run",
              "./cmd/datapan",
              "catalog",
              "diff",
              "--old",
              "/home/runner/work/datapan-registry/datapan-registry/.datapan/previous/data-go-kr.registry.json",
              "--new",
              "/home/runner/work/datapan-registry/datapan-registry/data/data-go-kr.registry.json",
              "--limit",
              "0",
              "--output",
              "/home/runner/work/datapan-registry/datapan-registry/reports/catalog-diff.json",
              "--json"
            ],
            "exit_code": 0,
            "input_registry_sha256": "0520d0db0d9ee07b7cbccce0c08439d0b02be901bf10e8491187d96e59d7a0d0",
            "input_previous_registry_sha256": "eeda72ee8590f458de8d75703662578e80edf3e61282f0e5e67547c4f6e5f644",
            "output_path": "reports/catalog-diff.json",
            "raw_output_bytes": 3254363,
            "raw_output_sha256": "c854343320ad93b08928611d983d3892d372c572facd49ac579d7587b526688c",
            "output_bytes": 3254333,
            "output_sha256": "0fc986acab3d4e24f615a90a523cd27e2827bc0b24b06823d47fb2002e1e94f0"
          },
          {
            "argv": [
              "go",
              "run",
              "./cmd/datapan",
              "catalog",
              "route-disposition",
              "--registry",
              "/home/runner/work/datapan-registry/datapan-registry/data/data-go-kr.registry.json",
              "--probe",
              "/home/runner/work/datapan-registry/datapan-registry/reports/unadapted-external-probe.json",
              "--limit",
              "0",
              "--output",
              "/home/runner/work/datapan-registry/datapan-registry/reports/route-disposition.json",
              "--json"
            ],
            "exit_code": 0,
            "input_registry_sha256": "0520d0db0d9ee07b7cbccce0c08439d0b02be901bf10e8491187d96e59d7a0d0",
            "output_path": "reports/route-disposition.json",
            "raw_output_bytes": 22918,
            "raw_output_sha256": "33d366e1b702b4795839b7cc7f5f7739798a1f02621a50619f67cd73fcb664cc",
            "output_bytes": 22918,
            "output_sha256": "0f218284fa3e6fbb33b26012a714ea8d63f43144b1d050da084d0b4db0ab65e3"
          },
          {
            "argv": [
              "go",
              "run",
              "./cmd/datapan",
              "catalog",
              "coverage",
              "--registry",
              "/home/runner/work/datapan-registry/datapan-registry/data/data-go-kr.registry.json",
              "--verification",
              "/home/runner/work/datapan-registry/datapan-registry/reports/latest-verification.json",
              "--route-disposition",
              "/home/runner/work/datapan-registry/datapan-registry/reports/route-disposition.json",
              "--limit",
              "0",
              "--output",
              "/home/runner/work/datapan-registry/datapan-registry/reports/coverage.json",
              "--json"
            ],
            "exit_code": 0,
            "input_registry_sha256": "0520d0db0d9ee07b7cbccce0c08439d0b02be901bf10e8491187d96e59d7a0d0",
            "input_verification_sha256": "79999f8ace142f5238283aa22ef87c35c6a2bc9d9b347827e3a969db94726d61",
            "output_path": "reports/coverage.json",
            "raw_output_bytes": 104146,
            "raw_output_sha256": "964b808e1da5a4f2e5a50321768aef8ebbeec87b29c3c319b576f71923ded959",
            "output_bytes": 104146,